{"authoring_eligibility":"UNDECIDED","blind_finder_eligible":false,"candidate_code":"C01","completion_status":"incomplete","construct_ledger_bridge_required":true,"errors":["FORM_NOT_COMPLETED"],"exposure_recorded":false,"form_id":"task194.audio-candidate.C01.form","h1_assigned":false,"h2_assigned":false,"minimality_assigned":false,"necessity_assigned":false,"packet_id":"task194.audio-candidate.C01","readiness_token":"AUDIO_CANDIDATE_PRESCREEN_PACKETS_REPAIR","record_type":"audio_candidate_prescreen_import","saturation_auditor_eligible":false,"schema_version":"1.0.0","source_group_id":"cc4d_p02_e02","source_id":"15_29"}
